Optical Sights,,,,,,,,
Attachment Name,Ruble Cost,USD Cost,Accuracy Bonus,Stability Bonus,Ergonomics Bonus,Special Notes/Restriction,Loyalty Req,Description
PK-06 Reflex Sight,"?15,000","$1,500 ",1,1,,1.0x,Loyalty 1,"Open reflex sight with automatic reticle brightness adjustment and switching between 3 reticle types. 
Basic to apply and use."
Aimpoint Micro T-1 Reflex Sight,"?28,000","$2,800 ",2,,,1.0x,Loyalty 1,"Compact Micro H-1 reflex sight by Aimpoint was designed for use with any kind of firearms. 
Lightweight and easy to use."
Trijicon RMR,"?17,500","$1,750 ",2,,,1.0x,Loyalty 1,"Handgun Reflex Sight. 
Can be utilized by rifles, but to a questionable degree."
Sig Sauer Romeo 4 Reflex Sight,"?90,000","$9,000 ",,2,5,1.0x,Loyalty 1,Compact Aimpoint designed for universal usage in all firearm builds.
Aimpoint Comp M4 Reflex Sight,"?80,000","$8,000 ",2,2,,1.0x,Loyalty 1,"Precision Optic designed to extremely rugged and operate continuously for up to 8 years using a single AA battery. 
Simple and effective as historically proven."
Cobra EKP-8-18 Reflex Sight,"?75,000","$7,500 ",1,1,5,1.0x,Loyalty 1,"Russian made Reflex Sight popular among PMC companies and citizen shooter usage alike.
It was originally designed for Russian usage, but was never formally adapted."
EOtech 553 Holo Sight,"?95,000","$9,500 ",1,3,,1.0x,Loyalty 1,"Holographic Reflex Sight designed to be shot using both eyes as opposed to shooting with one.
Utilized often by US SOCOM forces on special operations."
EOtech HHS-1 Sight,"?100,000","$10,000 ",3,-2,,1.0x / 3.0x,Loyalty 1,"Holographic Reflex Sight utilizing a magnifier for an additional magnification of 2x, to a range between 1x and 3x."
Nightforce ATACR 7-35x56 Rifle Scope,"?100,000","$10,000 ",2,,5,7.0x / 16.0x / 35.0x,Loyalty 1,"A 7x-35x Vision Scope for usage in Single-Shot Rifles such as Sniper Rifles or Marksmen Rifles. 
It features 3 zoom levels, being 7x, 16x, and 35x."
OKP-7 Reflex Sight,"?85,000","$8,500 ",2,,10,1.0x,Loyalty 2,"OKP sights that allow firing from unstable positions in rapidly changing conditions. 
Reduces the operator fatigue, and, if necessary, allows unhindered use of base mechanical sights."
Valday 1P87 Holo Sight,"?78,000","$7,800 ",2,2,5,1.0x,Loyalty 2,"Holographic Reflex Sight following similar origins to it's EOTech counterpart.
It's optic in particular is much easier on the eyes, being formed by dots rather than a solid shape."
Walter MRS Reflex Sight,"?81,000","$8,100 ",,,10,1.0x,Loyalty 2,"Reflex Walther Multi-Reticle Point Sight features 2 dots and 2 reticles with adjustable brightness levels. 
Compact, but fragile and prone to malfunction"
ELCAN SpecterDR 1/4x Scope,"?93,000","$9,300 ",4,-2,,1.0x / 4.0x,Loyalty 2,"Digital Scope capable of switching between 1x and 4x ranges at user need. 
Has it's own set of ironsights atop the scope if needed in CQB Situations."
"Leupold Mark 4 HAMR 4x24mm Hybrid Scope
","?60,000","$6,000 ",3,2,-10,4.0x / 1.0x (with PK-06),Loyalty 2,"4x Assault Scope capable of mounting a PK-06 Reflex-Sight at the top. 
Allows the user to quickly switch between two ranges instead of having to switch magnifications."
"Primary Arms Compact Prism 2.5x Scope
","?65,000","$6,500 ",-1,2,15,2.5x,Loyalty 2,"Compact 2.5x prism scope manufactured by Primary Arms. 
It's optic is wide and allows for easy target acquistion without the expense of shooter fatigue."
"Leupold Mark 4 LR 6.5-20x50 Rifle Scope
","?110,000","$11,000 ",3,2,5,20.0x,Loyalty 2,"A Long-range 20x Optic for utilization in Extreme Range Sniping. 
Highly impractical for most firearms save for Sniper Rifles."
March Tactical Optical Scope 3-24x42 FFP,"?115,000","$11,500 ",3,3,,3.0x / 14.0x / 24.0x,Loyalty 2,"A 3x-24x Rifle Scope that supports up to three magnifications, being 3x, 14x, and 24x. 
Generally easier to use in most firearms due to it's low inital magnification."
"EOtech Vudu 1-6 Rifle Scope
","?120,000","$12,000 ",2,2,10,1.0x / 6.0x,Loyalty 2,"A 1x-6x Rifle Scope that can fit it's role either as a close quarters optic, or medium range scope."
KMZ 1P69 3-10x Rifle Scope,"?150,000","$15,000 ",5,,20,3.0x / 10.0x,Loyalty 2,"A 3x-10x rifle scope with peculiar optical markings. 
Intended intially for the SV-98 platform, proper utilization of this optic can serve as a makeshift range-finder."
"Trijicon 4x ACOG Scope
","?72,000","$7,200 ",4,1,-15,4.0x,Loyalty 3,"4x Assault Scope utilized by US Forces operating in foreign areas of operation. 
Extremely precise and stable to use, but feels a bit bulky at times."
"Valday PS-320 1x/6x Scope
","?79,000","$7,900 ",3,3,-20,1.0x / 6.0x,Loyalty 3,"1x to 6x Digital Scope designed by Valday to compete with the ELCAN. Clear Sight picture, and overall easy to utilize."
Monstrum Compact Prism 2x32 Scope,"?83,000","$8,300 ",-2,4,,2.0x,Loyalty 3,"Compact prismatic scope with 2x magnification manufactured by Monstrum. 
Good for Close to Medium-ranged engagements."
"Sig BRAVO4 4X30 Scope
","?62,000","$6,200 ",1,,20,4.0x,Loyalty 3,"Designed by Sig, 
The BRAVO4 4X30 optical scope sight features the uniquely large FOV for clear sight pictures and overall performance. 
Features a rail mount on the top for pistol optics."
"Vortex Razor AMG UH-1 Holo-sight
","?97,500","$9,750 ",-2,5,10,1.0x,Loyalty 3,"Futuristic Holographic Sight design that allows for user target acquisation, without weighing the firearm down."
Burris FastFire 3 Reflex Sight,"?40,000","$4,000 ",1,1,,1.0x,Loyalty 3,"Compact and virtually non-existant weight wise, the FastFire Reflex sight provides a simple yet effective alternative to a weapons ironsight. 
It's also hard to destroy given it's size."
"VOMZ Pilad 4x32 Rifle Scope
","?210,000","$21,000 ",4,4,-5,4.0x / 32.0x,Loyalty 3,"4x-32x Rifle Scope designed for shooting at small and medium distances. 
Features simple crosshair optic for the uninitiated."
"NcSTAR ADO P4 Sniper 3-9x42 Rifle Scope
","?185,500","$18,550 ",2,2,,"3.0x / 9.0x, Night Optic Compatible",Loyalty 3,"A 3x-9x Digital Scope that comes with an Integrated Red Dot Sight at the top of the scope itself. 
A costly but versatile piece of equipment"
"VLK 3.0x Mid-range Optical Sight
","?215,000","$21,500 ",1,2,10,3.0x,Loyalty 3,"Classic 3.0x Digital Scope no longer sold on the Civilian Market. 
Manufactured locally as per PMC Demands."
APX5 Holographic Sight,"?215,000","$21,500 ",1,3,,1.5x Holographic,Loyalty 3,"Russian made Holo-sight that continues to see service to this day. 
1.5x Magnification, utilizing a unique green reticle compared to other holographic sights."
Functional Mods (Added Peripherals),,,,,,,,
Attachment Name,Ruble Cost,USD Cost,Stats,,,,Loyalty Req,Description
Harris HBR Bipod,"?4,000",$400 ,,,,Mounting Capable,Loyalty 1,A classic Bipod designed for keeping weapon systems stable on a surface.
Magpul AFG Horizontal Grip,"?15,000","$1,500 ",,,5,,Loyalty 1,"Angled Magpul Grip. Enables a more natural grip against the barrel axis.
Thanks to that, it reduces recoil and improves the weapon control."
Magpul RVG Vertical Grip,"?15,000","$1,500 ",,2,,,Loyalty 1,"Vertical Magpul Grip. Common, unsophisticated and inexpensive, it's design allows for shooter stability."
"SI ""Cobra Tactical"" Vertical Grip","?21,000","$2,100 ",,1,5,,Loyalty 1,"Integrates form with functionality. 
Its hybrid-designed shape works both as a regular foregrip and a comfortable hand stop for C-Clamp Operators."
KAC Vertical Pistol Grip,"?26,000","$2,600 ",2,2,,,Loyalty 1,"Vertical Pistol Grip produced by Knights Armament.
Slightly long, but helps overall firearm performance."
"SE-5 Express Grip
","?30,000","$3,000 ",1,2,5,,Loyalty 1,"Enables a more natural grip against the barrel axis.
Thanks to that, it reduces recoil and improves the weapon control."
AN/PEQ-2 Tactical Device,"?150,000","$15,000 ",2,,10,,Loyalty 1,Tactical device that combines laser designators in both visible and IR band with IR searchlight.
"Stiener Dbal PL Tactical Flashlight
","?15,000","$1,500 ",1,1,,Handgun Only includes Flashlight,Loyalty 1,"Steiner Dbal PL combined LED and green laser Weapon Light.
Sadly you cannot have both on at the same time."
UTG Steel Dovetail Mount for AK Systems,"?5,000",$500 ,,,,AK Dovetail Optic Mount,Loyalty 1,"(Free in slot, does not actually take up a slot, unless it is used without attaching an optic on it.) 
Simple Dovetail Mount for applicable AK platforms."
"Zenit RK-0 Foregrip
","?42,000","$4,200 ",-3,3,10,,Loyalty 2,"For utilization on most rail systems, it provides better operational control of weapon during fire at the cost of accuracy."
Hera Arms CQR Tactical Grip,"?70,000","$7,000 ",,5,-30,,Loyalty 2,"Easy to install, lightweight and compact frontgrip, for those wanting a CQB Firearm Setup.
Only available to AR-15 Platforms."
"Magpul M-LOK AFG Tactical Grip
","?44,000","$4,400 ",-2,-3,20,"AR Platform Only, MLOK",Loyalty 2,"Angled Magpul Grip. Enables a more natural grip against the barrel axis.
Thanks to that, it reduces recoil and improves the weapon control.
Only applicable to firearms with MLOKs."
Viking Tactical UVG Vertical Grip,"?32,000","$3,200 ",,2,10,,Loyalty 2,"Extremely lightweight tactical grip made from light alloy.
Allows for more freedom in terms of user carry weight."
Fortis Shift Tactical Grip,"?65,000","$6,500 ",,1,15,,Loyalty 2,"Grip allows you to handle the weapon with confidence. 
The organic design enables the operator to manipulate the rifle in a comfortable way."
Tango Down Stubby BGV-MK46K Tac Grip,"?65,000","$6,500 ",,2,10,,Loyalty 2,"Short grip for use with weapons of close and extra close quarters combat.
Ideally fits assault shotguns."
"ATPIAL LA-5 Tactical Device
","?200,000","$20,000 ",4,,15,,Loyalty 2,"ATPIAL (Advanced Target Pointer Illuminator Aiming Laser)
Combines Laser Designators in both visble and IR Band with IR Searchlights. 
The lifespan on this is greatly superior."
"Holosun LS321 Tactical Device
","?220,000","$22,000 ",3,2,-10,,Loyalty 2,"Holosun LS321 is a multi-laser tactical device with green laser in the visible light spectrum, IR laser and IR searchlight.
Extremely Bulky."
"Zenit 2P Klesch Flashlight + Laser Device
","?210,000","$21,000 ",2,2,,Light Illuminator,Loyalty 2,"Underbarrel-mounted LED flashlight ""2P Klesch + LCU"" produced by Zenit for utilization in Handguns and Sub-Machine Guns."
Zenit B-33 Dust Cover for AK Systems,"?8,000",$800 ,,,5,AK Dust Cover Optic Mount,Loyalty 2,"Dustcover that has an integrated rail on it for usage in AK Systems.
Enables ALL AKs to mount optics on the dustcover for ease of optic access."
M320 Underbarreled Grenade Launcher,"?200,000","$15,000 ",,,,Picatinny Underbarrel GL Attachment,Loyalty 2,"A single-shot 40mm underbarrel grenade launcher, 
Designed for installation on numerous Underbarreled Pictanny Rails."
GP-25 Underbarreled Grenade Launcher,"?200,000","$15,000 ",,,,"VOG-25, AK Underbarrel GL Attachment",Loyalty 2,"An Underbarrel Grenade Launcher for 40mm VOG-25 Grenades.
Designed for Installation on AK Platforms without Under-Rail Modularity."
RTM Pillau Tactical Grip,"?85,000","$8,500 ",3,,,,Loyalty 3,Lightweight aluminium tactical grip that allows for more accurate shots and easy target acquistional snaps.
Ultrafire WF-501B Flashlight,"?21,500","$2,150 ",,,-5,Light Illuminator,Loyalty 3,Simple but powerful LED flashlight with a sturdy body.
"Glock Tactical GL21 Flashlight with Laser
","?55,000","$5,500 ",2,3,,Handgun Only includes Flashlight,Loyalty 3,"Underbarrel-mounted LED flashlight with a laser aiming module produced by Glock. 
For specifc utilization by Glocks."
"AN/PEQ-15 Tactical Device
","?300,000","$30,000 ",5,-3,5,,Loyalty 3,"Tactical Device that has been improved on by the years.
Best in the field, and it runs on special solar powered batteries, enabling no downtime between days or weeks on end."
"Zenit Perst-3 Tactical Device
","?300,000","$30,000 ",-3,4,5,,Loyalty 3,"Slim Tactical Device used primarily in Night Raids.
It's placement will balance out the firearm so long as it's placed on the side or top rails of a given firearm."
Muzzle Devices,,,,,,,,
Attachment Name,Ruble Cost,USD Cost,Stats,,,,Loyalty Req,Description
Zenit DTK1 7.62x39/5.45x39 Muzzle Break,"?4,000",$400 ,,2,,7.62x39mm / 5.45x39mm,Loyalty 1,Muzzle Break used and designed for both 7.62 and 5.45 AK-Based Weapon Systems
Izhmash 5.45x39 AK-74 Systems Compensator,"?5,000",$500 ,2,,,5.45x39mm,Loyalty 1,Standard Izhmash-produced muzzle brake and compensator for AK74 and Systems developed from it.
COLT USGI A2 5.56x45 Flash Hider,"?8,000",$800 ,,1,10,5.56x45mm,Loyalty 1,"The 5.56x45 Colt USGI A2 Flash hider a.k.a. Bird Cage is designed for mounting on 5.56x45 weapons built on AR-15 system.
Currently in service for the M4A1 Platform."
PWS CQB 5.56x45 Muzzle Break,"?7,500",$750 ,1,1,,5.56x45mm,Loyalty 1,PWS CQB muzzle brake is designed specifically for compact arms and use in confined spaces.
AAC Illusion 9 9x19mm Silencer,"?9,000",$900 ,,,-5,"Noise Suppression, 9x19mm",Loyalty 1,"Illusion 9 is a compact, high performance silencer for modern 9mm semi-automatic pistols."
"Sig SRD 9x19mm Sound Suppressor
","?8,500",$850 ,-2,,5,"Noise Suppression, 9x19mm",Loyalty 1,"SRD 9 is a sound suppressor made by Sig. For 9mm utilization.
"
Hexagon AK74 5.45x39 Sound Suppessor,"?17,500","$1,750 ",,,,"Noise Suppression, 5.45x39mm, AK systems",Loyalty 1,"AK-74 shot sound suppressor from the Hexagon company.
As you may imagine, only serviceable to 5.45x39 AK Weapon Systems."
"SilencerCo Osprey 9 9x19mm Sound Suppressor
","?9,500","$9,500 ",1,,-5,"Noise Suppression, 9x19mm",Loyalty 1,"Light sound suppressor made by SilencerCo.
Known to many as a Monolith of a Supressor for it's rectangle design."
"Vityaz 9x19 Sound Supressing Device
","?7,000",$700 ,,1,5,"Noise Suppression, 9x19mm, Vityaz-SN only",Loyalty 1,"Izhmash-produced sound suppressing device for Vityaz SMG of previous generations.
For Vityaz-SN exclusive use."
"SilencerCo Omega 45k .45ACP Sound Suppessor
","?32,000","$3,200 ",1,,,"Noise Suppression, .45 ACP",Loyalty 1,"Light sound suppressor made by SilencerCo.
Known to many as a Monolith of a Supressor for it's rectangle design.
This one supports .45 ACP."
KAC QDSS NT-4 5.56x45 Suppressor,"?17,500","$1,750 ",,,,"Noise Suppression, 5.56x45mm/.223 only, AR-15 Platforms",Loyalty 1,"KAC QDSS NT-4 5.56x45 and .223 silencer, can only be installed on compatible KAC muzzle devices. 
(Notably for the AR-15 Platform. Also comes with it.)"
"Gemtech SFN-57 Suppressor + 
Threaded Barrel Conversion","?20,000","$2,000 ",1,,,"Noise Suppression, Five-Seven only",Loyalty 1,"The SFN-57 is a compact, high performance sound suppressor for the modern day Five-Seven Handgun. 
Comes with a Threaded Barrel with it's installation."
"DSR-1 Subsonic Conversion
","?60,000
","$6,000 ",-1,3,,"Weight Reduction [2], DSR-1 Only","Loyalty 1
","Converts the Standard DSR-1 to a Subsonic Varient.
The barrel length is reduced down to a 310mm, with a adaptation to the inner rifling of the rifle's internals.
The result is a bullet velocity traveling below the speed of sound at an approx. 340 m/s (1,100 ft/s)"
"SIG Sauer SRD762-QD 7.62x51 Sound Suppressor
","?17,500
","$1,750 ","1
",,,"Noise Suppression, 7.62x51mm","Loyalty 1
","7.62x51 mm Sound Suppressor for use in most modern day 7.62x51mm Rifles. 
Utilizing a special made muzzle converter, you can now use this with other rifles!
*Results may vary."
"Surefire SOCOM556-MONSTER 5.56x45 Silencer
","?17,000","$1,700 ",,1,-5,"Noise Suppression, 5.56x45mm",Loyalty 2,"Surefire SOCOM556-MONSTER 5.56x45 and .223 silencer. 
Can only be installed on compatible Surefire muzzle devices. (It comes with it.)"
B&T Rotex 2 4.6x30 Silencer,"?15,000","$1,500 ",,2,,"Noise Suppression, 4.6x30mm",Loyalty 2,"Rotex 2 is a 4.6x30 mm suppressor produced by Brügger & Thomet.
Can only specifically be utilized on the MP7A1 and A2."
Daniel Defence Wave QD Sound Suppressor,"?20,000","$2,000 ",,,5,"Noise Suppression, Multi-Caliber?",Loyalty 2,"Daniel Defence Wave QD sound suppressor, utilized by several American Units. 
Which can be installed over a Wave muzzle brake. (It comes with it.)"
"SilencerCo Salvo 12 Gauge Suppressor
","?32,000
","$3,200 ",1,2,,"Noise Suppression, 12x70mm","Loyalty 2
","Sound Moderator created by SilencerCo for use in 12 Gauge Shotguns.
Comes with it's required adapter mount.
Also Uniformly Rectangle, which is a bit weird for aesthetic sake."
"PBS-4 5.45x39 Silencer
","?28,000","$2,800 ",,2,-5,"Noise Suppression, 5.45x39mm",Loyalty 3,"The PBS-4 silencer manufactured by TSNIITochMash.
Made for use as part of the ""Canary"" assault rifle grenade launcher system. 
AK Platform only."
"Rotor 43 7.62x39 Muzzle Brake
","?60,000","$6,000 ",2,3,15,7.62x39mm,Loyalty 3,"Rotor 43 muzzle brake, is designed for installation on AK 7.62x39.
Although positioned as muzzle brake, it also works as a sound supressor."
"PBS-1 7.62x39 Silencer
","?70,000","$7,000 ",,2,-5,"Noise Suppression, 7.62x39mm",Loyalty 3,"PBS-1 is a device manufactured by TSNIITochmash
Developed for noiseless and flash-free fire with 7.62mm modernized Kalashnikov."
Grips ,,,,,,,,
Attachment Name,Ruble Cost,USD Cost,Stats,,,,Loyalty Req,Description
Izhmash AK Polymer Pistol Grip,?4000,$400 ,,,20,AK System,Loyalty 1,"Izhmash polymer pistol grip for AK and compatibles, designed to replace the old bakelite grip."
Izhmash AK Bakelite Pistol Grip,?5000,$500 ,,,25,AK System,Loyalty 1,"A bakelite Izhmash pistol grip for AK compatible weapons. 
Originally installed on AKM and AKMS. Tried and Tested after a century worth of conflict."
DI ECS FDE Pistol Grip (AR),?7000,$700 ,,,20,AR Platform,Loyalty 1,"ECS polymer pistol grip can be installed at any weapon compatible with AR-15 grips.
This one colored in Tan."
Zenit RK-3 AK pistol grip,?8000,$800 ,,1,10,AK System,Loyalty 2,"RK-3 Classica anatomic pistol grip features built-in hermetically sealed battery storage compartment.
Designed for installation as replacement of standard AK pistol grip."
Magpul MOE AR-15 Pistol Grip,?8500,$850 ,,,25,AR Platform,Loyalty 2,"Polymer Magpul MOE (Magpul Original Equipment) pistol grip
Can be installed on any weapon compatible with AR-15 pistol grips."
TAPCO SAW-Style Pistol Grip (AK),?6000,$600 ,1,,15,AK System,Loyalty 3,"Anatomical pistol grip inspired by M249 SAW LMG grip.
Comes in black and flat dark earth."
